{
    "extracted_at":  "2026-09-12T08:13:47Z",
    "user_max_budget_eur":  150,
    "total_valid_listings":  2,
    "search_status":  "SUCCESS",
    "listings":  [
                     {
                         "id":  "item_01_valid_under_budget",
                         "title":  "Hotel Duomo Milano",
                         "location":  "Milan, Italie",
                         "price_per_night_eur":  120,
                         "currency":  "EUR",
                         "url":  "https://www.google.com/travel/hotels?q=Duomo%20Milano\u0026dates=2026-09-30%2C2026-10-02\u0026adults=3\u0026hl=fr",
                         "is_url_verified":  true,
                         "http_status":  200,
                         "is_over_budget_suggestion":  false
                     },
                     {
                         "id":  "item_02_valid_zero_hallucination_nulls",
                         "title":  null,
                         "location":  null,
                         "price_per_night_eur":  135,
                         "currency":  "EUR",
                         "url":  "https://www.google.com/travel/hotels?q=Milano%20Centrale\u0026dates=2026-09-30%2C2026-10-02\u0026adults=3\u0026hl=fr",
                         "is_url_verified":  true,
                         "http_status":  200,
                         "is_over_budget_suggestion":  false
                     }
                 ],
    "over_budget_suggestions":  [
                                    {
                                        "id":  "item_03_over_budget_within_5pct",
                                        "title":  "Grand Hotel Milan Prestige",
                                        "location":  "Milan, Italie",
                                        "price_per_night_eur":  154,
                                        "currency":  "EUR",
                                        "url":  "https://www.kayak.fr/hotels/Milan/2026-09-30/2026-10-02/3adults",
                                        "is_url_verified":  true,
                                        "http_status":  200,
                                        "is_over_budget_suggestion":  true
                                    }
                                ]
}
